<?xml version="1.0" encoding="UTF-8"?>
<Jobs executionTime="1" commandTimeout="3600" xmlns:xsi="http://www.w3.org/2001/XMLSchema-instance" xsi:noNamespaceSchemaLocation="J:\E-PRTR Test\Performance Test\SPPerformanceTester\TestRunData.xsd">
	<Job name="One User">
		<Threads>
			<Thread name="MyThread" Id="1" ThreadCopies="1">
				<Tasks>
					<Script executionString="SELECT * FROM FACILITYSEARCH_ALL" />
				</Tasks>
			</Thread>
		</Threads>
	</Job>
	<Job name="Five Users">
		<Threads>
			<Thread name="MyThread" Id="1" ThreadCopies="5">
				<Tasks>
					<Script executionString="SELECT * FROM FACILITYSEARCH_ALL" />
				</Tasks>
			</Thread>
		</Threads>
	</Job>
</Jobs>